titulo,descripcion,fecha_inicio,fecha_fin,ubicacion,tipo,organizador,estado
Festival Internacional de Jazz,Un festival que reúne a los mejores músicos de jazz del mundo.,2024-01-15,2024-01-17,Teatro Nacional,Festival,Jazz World,Programado
Cumbre de Innovación Tecnológica,Un evento para discutir las últimas tendencias en tecnología.,2024-02-10,2024-02-12,Centro de Innovación,Conferencia,Tech Leaders,Inscrito
Maratón de la Ciudad,"Una maratón abierta a todos los corredores, con premios para los ganadores.",2024-03-05,2024-03-05,Parque Central,Deporte,Club de Corredores,Inscrito
Exposición de Arte Contemporáneo,Muestra de obras de artistas contemporáneos.,2024-04-01,2024-04-15,Galería de Arte,Exposición,Cultura Viva,Finalizado
Conferencia sobre Salud Mental,Charlas y talleres sobre la importancia de la salud mental.,2024-05-20,2024-05-20,Auditorio Principal,Conferencia,Salud y Bienestar,Programado
